{
  "schemaVersion": 1,
  "id": "11111111-1111-1111-1111-111111111111",
  "jobId": "22222222-2222-2222-2222-222222222222",
  "captureId": "33333333-3333-3333-3333-333333333333",
  "ownerUserId": "44444444-4444-4444-4444-444444444444",
  "capability": "audio.transcribe",
  "policySnapshotId": "55555555-5555-5555-5555-555555555555",
  "policyDigest": "sha256:aaaaaaaaaaaaaaaaaaaaaaaaaaaaaaaaaaaaaaaaaaaaaaaaaaaaaaaaaaaaaaaa",
  "registryDigest": "sha256:bbbbbbbbbbbbbbbbbbbbbbbbbbbbbbbbbbbbbbbbbbbbbbbbbbbbbbbbbbbbbbbb",
  "evaluatedAt": "2026-08-30T22:00:00Z",
  "chosenProcessorId": "taskdeck.whisperx",
  "consentGrantId": null,
  "budgetReservationId": null,
  "cacheHit": false,
  "forcedRerun": false,
  "forcedRerunReason": null,
  "alternatives": [
    {
      "processorId": "taskdeck.whisperx",
      "processorVersion": "1.0.0",
      "model": "large-v3",
      "executionMode": "sidecar",
      "eligibility": "chosen",
      "reasonCodes": [],
      "estimatedCost": 0,
      "currency": "GBP"
    },
    {
      "processorId": "provider.cloud-speech",
      "processorVersion": "1.0.0",
      "model": "default",
      "executionMode": "remote",
      "eligibility": "ineligible",
      "reasonCodes": [
        "consent-required"
      ],
      "estimatedCost": 0.02,
      "currency": "GBP"
    }
  ]
}
